,title,originallink,link,description,pubDate
274,"&apos;이광수♥&apos; <b>이선빈</b>, 누가 껴준 꽃반지? 사랑스러운 일상 공개 [스타IN★]",http://star.mt.co.kr/stview.php?no=2022061711293112091,https://n.news.naver.com/mnews/article/108/0003063008?sid=106,배우 <b>이선빈</b>이 자유로운 일상을 공개했다. <b>이선빈</b>은 지난 16일 자신의 인스타그램에 여러 장의 사진을 게재했다. 사진 속 <b>이선빈</b>은 꽃 반지를 끼고 밝은 웃음을 보이고 있다. 또 다른 사진 속엔 넓은 들판을 거닐며... ,"Fri, 17 Jun 2022 11:45:00 +0900"
275,<b>이선빈</b> &apos;♥이광수&apos;에 반지 받고 신났나… 기뻐서 헤드뱅잉?,http://moneys.mt.co.kr/news/mwView.php?no=2022061709372197829,https://n.news.naver.com/mnews/article/417/0000823368?sid=106,배우 <b>이선빈</b>이 근황을 알렸다. 지난 16일 <b>이선빈</b>은 인스타그램에 카메라 이모티콘과 웃음 이모티콘을 올렸다. 이와 함께 올린 흑백사진에는 손가락에 꽃반지를 끼고 은은한 미소를 짓고 있는 그의 모습이 보인다. 이어... ,"Fri, 17 Jun 2022 09:55:00 +0900"
276,첫 등장부터 &apos;한소희 닮은꼴+완벽 몸매&apos;로 남심 저격한 &apos;에덴&apos; 여성 참가자 (...,https://www.insight.co.kr/news/399911,https://www.insight.co.kr/news/399911,"MC 시미즈는 &quot;<b>이선빈</b> 너무 닮으셨는데?&quot;라고 말했고, MC 이홍기는 &quot;한소희&quot;라고 외쳤다.이승재는 &quot;얼굴도 너무 작고 뭐 장난이 아니더라고요. 키도 엄청 크고 비율도 너무 좋고&quot;라고 얘기했다.예쁜 얼굴과 완벽한 몸매를... ","Fri, 17 Jun 2022 09:14:00 +0900"
277,"누가 껴준 반지야? &apos;♥이광수&apos; <b>이선빈</b>, 기뻐서 헤드뱅잉까지",http://www.mydaily.co.kr/new_yk/html/read.php?newsid=202206170850894936&ext=na&utm_campaign=naver_news&utm_source=naver&utm_medium=related_news,https://n.news.naver.com/mnews/article/117/0003614751?sid=106,배우 <b>이선빈</b>이 근황을 공개했다. <b>이선빈</b>은 16일 자신의 SNS에 일상사진을 게재했다. 공개된 사진 속에서 <b>이선빈</b>은 손에 낀 꽃반지를 드러내며 옅은 미소를 보이고 있다. 또 다른 사진에서는 긴 머리카락이 휘날릴 만큼... ,"Fri, 17 Jun 2022 08:58:00 +0900"
278,"<b>이선빈</b>, ♥이광수에게 받은 &apos;프러포즈 반지?&apos;…대놓고 &apos;럽스타♥?&apos;",http://sports.chosun.com/news/ntype.htm?id=202206180100121380007670&servicedate=20220617,https://n.news.naver.com/mnews/article/076/0003881854?sid=106,"배우 <b>이선빈</b>이 애교 가득한 근황을 전했다. <b>이선빈</b>은 16일 자신의 SNS에 별다른 설명 없이 여러 장의 사진을 게재했다. 공개된 사진 속 <b>이선빈</b>은 손가락에 꽃으로 만든 꽃반지가 끼워 있었고, 네티즌들은 &quot;혹시... ","Fri, 17 Jun 2022 05:11:00 +0900"
279,비빔면 아성에 도전한 막국수·냉면…夏夏 계절면 누가 웃을까,http://www.kookje.co.kr/news2011/asp/newsbody.asp?code=0200&key=20220617.22011004175,https://n.news.naver.com/mnews/article/658/0000012363?sid=101,태양초의 매운맛에 사과와 타마린드 양념소스를 더해 시원하면서 새콤한 맛을 내는 등 맛을 강화하는 동시에 드라마 ‘술꾼도시여자들’의 <b>이선빈</b> 한선화 정은지를 모델로 앞세워 적극적인 마케팅을 펼치고 있다.... ,"Fri, 17 Jun 2022 03:02:00 +0900"
280,"라면업계, 계절면 전쟁 &apos;빅뱅&apos;…&quot;2000억원 대 시장 잡아라&quot;",http://www.inews24.com/view/1491191,https://n.news.naver.com/mnews/article/031/0000679501?sid=101,"라면업계 한 관계자는 &quot;올해도 업계에서 유재석, 술꾼도시여자들 <b>이선빈</b>, 한선화, 정은지 등 여러 모델을 투입하며 제품 홍보에 열을 올리고 있다&quot;며 &quot;계절면 시장은 지속 성장하고 있어서 앞으로 더 경쟁은 치열해질... ","Thu, 16 Jun 2022 17:27:00 +0900"
281,"비빔면 전쟁, 팔도 1위 수성에… 2위 쟁탈전 후끈",http://moneys.mt.co.kr/news/mwView.php?no=2022061515573490621,https://n.news.naver.com/mnews/article/417/0000822841?sid=101,"오뚜기 진비빔면은 드라마 술꾼도시여자들에서 활약한 배우 <b>이선빈</b>, 한선화, 정은지를 모델로 발탁했다. 이들은 드라마에서 보여준 모습처럼 시원하고 유쾌한 매력을 진비빔면에서 살렸다는 평가다. 드라마속... ","Thu, 16 Jun 2022 06:30:00 +0900"
282,[스타서베이] 6월 3주차 남녀 가수·배우·아이돌 &apos;브랜드 파워&apos; 랭킹 투표 시...,http://www.topstarnews.net/news/articleView.html?idxno=14698921,http://www.topstarnews.net/news/articleView.html?idxno=14698921,"이성경, <b>이선빈</b>, 이레, 김유정, 염정아, 수지, 이다희, 차예련 등 66명이 이름을 올렸다. 지난 &apos;6월 2주차 남자 배우 브랜드 파워 랭킹&apos;에서는 박서함이 총 득표수 1,722,030표 중 532,800표를 획득하며 1위를 했다. 박서함은... ","Wed, 15 Jun 2022 16:36:00 +0900"
283,[IB토마토]비빔면 시장 경쟁 후끈…40년 팔도 아성 &apos;흔들흔들&apos;,http://www.newstomato.com/ReadNews.aspx?no=1128431&inflow=N,http://www.newstomato.com/ReadNews.aspx?no=1128431&inflow=N,"농심은 올해에도 방송인 유재석을 앞세워 공격적인 마케팅을 펼치고 있으며 오뚜기 또한 드라마 ‘술꾼도시여자들’의 <b>이선빈</b>, 한선화, 정은지를 모델로 내세워 비빔면 시장 2위 탈환에 나서겠다는 각오를 보이고... ","Wed, 15 Jun 2022 06:02:00 +0900"
284,"<b>이선빈</b>, 상큼한 미소로 전한 근황 &apos;일상이 화보&apos; [리포트:컷]",https://www.tvreport.co.kr/2105876,https://n.news.naver.com/mnews/article/213/0001219524?sid=106,배우 <b>이선빈</b>이 근황을 공개했다. <b>이선빈</b>은 13일 자신의 인스타그램을 통해 “하뜨 받아랏”이라는 글과 함께 사진 한 장을 게재했다. 사진에는 <b>이선빈</b>이 손으로 하트 포즈를 취하고 있는 모습이 담겨있다. 화이트 룩에... ,"Tue, 14 Jun 2022 18:31:00 +0900"
285,"<b>이선빈</b>, ♥이광수 향한 애교 발산? &quot;하뜨 받아랏&quot; [TEN★]",https://tenasia.hankyung.com/tv/article/2022061405354,https://n.news.naver.com/mnews/article/312/0000552601?sid=106,배우 <b>이선빈</b>이 애교 가득한 근황을 전했다. <b>이선빈</b>은 14일 자신의 인스타그램을 통해 &quot;하뜨 받아랏♥&quot;이라는 글과 함께 한 장의 사진을 게재했다. 공개된 사진 속에는 <b>이선빈</b>이 손 하트를 포즈를 취하고 있는 모습이... ,"Tue, 14 Jun 2022 18:12:00 +0900"
286,"<b>이선빈</b>, 혹시 ♥이광수에게 보내는 하트?..얼굴도 예쁜데 애교까지",http://biz.heraldcorp.com/view.php?ud=202206141219093796936_1,https://n.news.naver.com/mnews/article/112/0003565665?sid=106,배우 <b>이선빈</b>이 애교 가득한 모습을 보여줬다. 14일 <b>이선빈</b>은 자신의 인스타그램 계정에 근황 사진을 게재했다. <b>이선빈</b>은 사진과 함께 &quot;하뜨 받아랏♥&quot;이라고 글을 남겼다. 사진 속 <b>이선빈</b>은 손하트를 하며 애교 가득한... ,"Tue, 14 Jun 2022 12:22:00 +0900"
287,"씨스타 출신 다솜, 달라붙는 빨간 체크바지도 소화..핫한 글래머",http://biz.heraldcorp.com/view.php?ud=202206131713061388017_1,https://n.news.naver.com/mnews/article/112/0003565464?sid=106,&apos;리버스&apos;는 의문의 별장 폭발 사고와 함께 기억을 잃은 &apos;묘진&apos;(<b>이선빈</b>)과 그녀의 헌신적인 피앙세이자 서광그룹 차기 회장 &apos;준호&apos;(이준혁)가 폭발 사고의 충격적인 진실을 마주하며 벌어지는 미스터리 스릴러다.,"Mon, 13 Jun 2022 17:19:00 +0900"
288,"&quot;냉면, 비싸도 너무 비싸다&quot;…올 여름 계절면 &apos;반사이익&apos;",http://www.newsis.com/view/?id=NISX20220613_0001904602&cID=13001&pID=13000,https://n.news.naver.com/mnews/article/003/0011244103?sid=101,"오뚜기는 <b>이선빈</b>, 한선화, 정은지 등과 함께 진비빔면의 시장 점유율 확대를 노린다. 삼양식품은 올 여름 시장 공략을 위해 비빔밀면을 새롭게 출시했다. 풀무원식품도 지난해 출시한 정·백·홍 비빔면으로 올 여름... ","Mon, 13 Jun 2022 15:21:00 +0900"
289,"씨스타 다솜, 용기가 필요한 체커보드 팬츠룩! ‘뭘 입어도 예뻐’",http://www.fashionn.com/board/read_new.php?table=1024&number=41690,http://www.fashionn.com/board/read_new.php?table=1024&number=41690,"다솜은 지난 2017년 씨스타 해체를 발표한 후 배우로도 활약 중이다. 지난해엔 JTBC 드라마&apos; 우리, 사랑했을까&apos;에 출연해 배우로서 입지를 다졌다. 최근에는 드라마 &apos;리버스&apos; 출연을 확정, 배우 <b>이선빈</b>과 호흡을 맞출 예정이다.","Mon, 13 Jun 2022 11:48:00 +0900"
290,"&quot;용기 내 입었다&quot; 다솜, 빨간 체크무늬 바지 도전 [리포트:컷]",https://www.tvreport.co.kr/2105623,https://n.news.naver.com/mnews/article/213/0001219291?sid=106,"지난해엔 JTBC 드라마&apos; 우리, 사랑했을까&apos;에 출연해 배우로서 입지를 다졌다. 최근에는 드라마 &apos;리버스&apos; 출연을 확정, 배우 <b>이선빈</b>과 호흡을 맞출 것을 예고했다. 사진= 다솜 인스타그램 캡처","Mon, 13 Jun 2022 11:07:00 +0900"
291,"샤이니 키-<b>이선빈</b>-이던-기은세, 반려동물과 함께한 발렌티노 나들이",http://zine.istyle24.com/Star/StarView.aspx?Idx=58783&Menu=3&_C_=23069,http://zine.istyle24.com/Star/StarView.aspx?Idx=58783&Menu=3&_C_=23069,"이던, <b>이선빈</b>, 기은세가 한남동에서 진행된 &lt;발렌티노 가라바니 락스터드 펫&gt; 팝업 이벤트에... ▲ 사진 제공= ⓒ 발렌티노 가라바니 (<b>이선빈</b>, 기은세) 반려동물 ‘무스’와 방문한 <b>이선빈</b>은 변함없는... ","Mon, 13 Jun 2022 09:32:00 +0900"
292,"샤이니 키·<b>이선빈</b>·이던-기은세, 반려동물과 함께 &apos;발렌티노 펫&apos; 팝업 나들이",http://www.slist.kr/news/articleView.html?idxno=360852,http://www.slist.kr/news/articleView.html?idxno=360852,"샤이니 키, 이던, <b>이선빈</b>, 기은세가 한남동에서 진행된 &apos;발렌티노 가라바니 락스터드 펫&apos;&gt; 팝업 이벤트에... 반려동물 &apos;무스&apos;와 방문한 <b>이선빈</b>은 변함없는 미모와 한층 성숙해진 분위기로 등장해 시선을 사로잡았다. 2022... ","Mon, 13 Jun 2022 09:24:00 +0900"
293,"&quot;용기 내어 입어봤다&quot; 씨스타 다솜, 어떤 바지길래",http://www.osen.co.kr/article/G1111870414,https://n.news.naver.com/mnews/article/109/0004635833?sid=106,"지난해엔 JTBC 드라마&apos; 우리, 사랑했을까&apos;에 출연해 배우로서 입지를 다졌다. 최근에는 드라마 &apos;리버스&apos; 출연을 확정, 배우 <b>이선빈</b>과 호흡을 맞출 것을 예고했다. / walktalkunique@osen.co.kr [사진] 다솜 SNS","Sun, 12 Jun 2022 20:09:00 +0900"
294,"한선화, 과감한 시스루룩..청순하고 섹시하고 다해",http://biz.heraldcorp.com/view.php?ud=202206111636097276322_1,https://n.news.naver.com/mnews/article/112/0003565095?sid=106,"티빙 오리지널 &apos;술꾼도시여자들&apos;로 큰 사랑을 받은 바 있다. <b>이선빈</b>, 한선화, 정은지 주연의 &apos;술꾼도시여자들&apos;은 퇴근 후 술 한잔이 인생의 신념인 세 여자의 &apos;술펀질펀&apos;한 이야기를 담은 작품이다. 시즌2 제작을 확정 지었다.","Sat, 11 Jun 2022 17:32:00 +0900"
295,"&apos;이광수♥&apos; <b>이선빈</b>, 반려견과 행복한 일상…청순美 뿜뿜 [인스타]",http://enews.imbc.com/News/RetrieveNewsInfo/350616,https://n.news.naver.com/mnews/article/408/0000158077?sid=106,배우 <b>이선빈</b>이 행복한 일상을 공유했다. 지난 10일 <b>이선빈</b>은 개인 인스타그램을 통해 “초대해주셔서 감사해요”라는 글과 함께 관련 해시태그를 덧붙인 여러 장의 사진을 게재했다. 공개된 사진 속 <b>이선빈</b>은 반려견과... ,"Sat, 11 Jun 2022 07:02:00 +0900"
296,"[뉴스1 ★]<b>이선빈</b>·기은세·키·던, 댕댕이와 함께 이태원 산책",https://www.news1.kr/articles/?4708358,https://n.news.naver.com/mnews/article/421/0006151104?sid=103,"배우 <b>이선빈</b>, 기은세와 가수 던, 샤이니 키가 한남동에서 포착됐다. <b>이선빈</b>, 기은세, 키, 던은 10일 서울 용산구 한남동 앤트러사이트에서 열린 발렌티노 가라바니 락스터드 펫 팝업 기념 포토콜에 각각 자신들과 닮은... ","Fri, 10 Jun 2022 19:59:00 +0900"
297,"<b>이선빈</b>, 반려견과 행복한 나들이",http://sports.hankooki.com/news/articleView.html?idxno=6799206,http://sports.hankooki.com/news/articleView.html?idxno=6799206,<b>이선빈</b>. ⓒ이혜영 기자 lhy@hankooki.com<b>이선빈</b>. ⓒ이혜영 기자 lhy@hankooki.com<b>이선빈</b>. ⓒ이혜영 기자 lhy@hankooki.com<b>이선빈</b>. ⓒ이혜영 기자 lhy@hankooki.com <b>이선빈</b>이 10일 오후 서울 한남동... ,"Fri, 10 Jun 2022 17:44:00 +0900"
298,"<b>이선빈</b>, 반려견 무스와 함게",http://sports.hankooki.com/news/articleView.html?idxno=6799195,http://sports.hankooki.com/news/articleView.html?idxno=6799195,<b>이선빈</b>. ⓒ이혜영 기자 lhy@hankooki.com<b>이선빈</b>. ⓒ이혜영 기자 lhy@hankooki.com<b>이선빈</b>. ⓒ이혜영 기자 lhy@hankooki.com<b>이선빈</b>. ⓒ이혜영 기자 lhy@hankooki.com <b>이선빈</b>이 10일 오후 서울 한남동... ,"Fri, 10 Jun 2022 17:20:00 +0900"
299,"[포토씨] 이던, 몽환적 비주얼 (발렌티노 가라바니)",http://www.cbci.co.kr/news/articleView.html?idxno=428617,http://www.cbci.co.kr/news/articleView.html?idxno=428617,"이날 행사에는 이던, <b>이선빈</b>, 키, 기은세가 참석해 자리를 빛냈다. 한편, 이번 &apos;발렌티노 락스터드 펫&apos; 팝업 이벤트는 10일, 11일 양일간 &apos;앤트러사이트&apos; 한남점에서 오전11시부터 밤8시까지 진행된다. 햇님이와... ","Fri, 10 Jun 2022 16:40:00 +0900"
300,"[포토씨] 기은세, 초록 (발렌티노 가라바니)",http://www.cbci.co.kr/news/articleView.html?idxno=428616,http://www.cbci.co.kr/news/articleView.html?idxno=428616,"이날 행사에는 이던, <b>이선빈</b>, 키, 기은세가 참석해 자리를 빛냈다. 한편, 이번 &apos;발렌티노 락스터드 펫&apos; 팝업 이벤트는 10일, 11일 양일간 &apos;앤트러사이트&apos; 한남점에서 오전11시부터 밤8시까지 진행된다. 기은세... ","Fri, 10 Jun 2022 16:32:00 +0900"
301,"[포토씨] 샤이니 키, 완벽 (발렌티노 가라바니)",http://www.cbci.co.kr/news/articleView.html?idxno=428608,http://www.cbci.co.kr/news/articleView.html?idxno=428608,"이날 행사에는 이던, <b>이선빈</b>, 키, 기은세가 참석해 자리를 빛냈다. 한편, 이번 &apos;발렌티노 락스터드 펫&apos; 팝업 이벤트는 10일, 11일 양일간 &apos;앤트러사이트&apos; 한남점에서 오전11시부터 밤8시까지 진행된다. 반려견 꼼데... ","Fri, 10 Jun 2022 16:28:00 +0900"
302,"[포토씨] <b>이선빈</b>, 엄마미소 (발렌티노 가라바니)",http://www.cbci.co.kr/news/articleView.html?idxno=428613,http://www.cbci.co.kr/news/articleView.html?idxno=428613," 배우 <b>이선빈</b>이 10일 오후 서울 용산구 한남동 앤트러사이트에서 진행된 이탈리아 럭셔리 &apos;발렌티노 가라바니 락스터드 펫&apos; 팝업 이벤트에 참석했다. 이날 행사에는 이던, <b>이선빈</b>, 키, 기은세가 참석해 자리를 빛냈다.... ","Fri, 10 Jun 2022 16:28:00 +0900"
303,"<b>이선빈</b>, 반려견 무스 안고 러블리 미소",https://www.news1.kr/photos/view/?5420868,https://n.news.naver.com/mnews/article/421/0006150759?sid=106,= 배우 <b>이선빈</b>이 10일 서울 용산구 한남종 앤트러사이트에서 열린 발렌티노 가라바니 락스터드 펫 팝업 기념 포토콜에서 반려견 무스와 포즈를 취하고 있다. 2022.6.10/뉴스1,"Fri, 10 Jun 2022 16:01:00 +0900"
304,"<b>이선빈</b>, 산책나온 무스 엄마",https://www.news1.kr/photos/view/?5420866,https://n.news.naver.com/mnews/article/421/0006150758?sid=106,= 배우 <b>이선빈</b>이 10일 서울 용산구 한남종 앤트러사이트에서 열린 발렌티노 가라바니 락스터드 펫 팝업 기념 포토콜에서 반려견 무스와 포즈를 취하고 있다. 2022.6.10/뉴스1,"Fri, 10 Jun 2022 16:01:00 +0900"
305,"[포토]<b>이선빈</b>, 귀여워서 깜놀",http://biz.heraldcorp.com/view.php?ud=202206101559154827605_1,https://n.news.naver.com/mnews/article/112/0003564859?sid=106,배우 <b>이선빈</b>이 10일 오후 서울 용산구 한남동에 위치한 엔트러사이트에서 진행된 발렌티노 가라바니 락스터드 펫 팝업이벤트에 참석해 포토타임 촬영에 임하고 있다.,"Fri, 10 Jun 2022 16:00:00 +0900"
306,"[S포토] <b>이선빈</b>, &apos;애지중지~&apos; (발렌티노 가라바니)",http://www.stardailynews.co.kr/news/articleView.html?idxno=323807,http://www.stardailynews.co.kr/news/articleView.html?idxno=323807,"이탈리아 럭셔리 오트 쿠틔르 브랜드, 메종 발렌티노에서 &apos;발렌티노 가라바니 락스터드 펫(VALENTINO GARAVANI Rockstud Pet)&apos; 팝업 이벤트를 진행했다. 이날 셀럽으로 배우 <b>이선빈</b>이 참석해 포토타임을 가지고 있다.","Fri, 10 Jun 2022 15:38:00 +0900"
307,"[포토] <b>이선빈</b>, 무결점 비주얼",http://www.sisafocus.co.kr/news/articleView.html?idxno=278705,http://www.sisafocus.co.kr/news/articleView.html?idxno=278705,배우 <b>이선빈</b>이 포즈를 취하고 있다. [사진 /오훈 기자]배우 <b>이선빈</b>이 포즈를 취하고 있다. [사진 /오훈 기자] 배우 <b>이선빈</b>이 10일 오후 서울 용산구 한남동 앤트러사이트 한남점에서 열린 발렌티노 가라바니 락스터트 펫... ,"Fri, 10 Jun 2022 15:36:00 +0900"
308,"[포토] 샤이니 키, 세련된 남친룩",http://www.sisafocus.co.kr/news/articleView.html?idxno=278702,http://www.sisafocus.co.kr/news/articleView.html?idxno=278702,"기자] 그룹 샤이니 키가 10일 오후 서울 용산구 한남동 앤트러사이트 한남점에서 열린 발렌티노 가라바니 락스터트 펫 팝업 행사에서 포즈를 취하고 있다. 이 자리에는 샤이니 키, 이던, <b>이선빈</b>, 기은세가 참석했다.","Fri, 10 Jun 2022 15:24:00 +0900"
309,"[S포토] <b>이선빈</b>, &apos;사랑스러운 손길로~&apos; (발렌티노 가라바니)",http://www.stardailynews.co.kr/news/articleView.html?idxno=323801,http://www.stardailynews.co.kr/news/articleView.html?idxno=323801,"이탈리아 럭셔리 오트 쿠틔르 브랜드, 메종 발렌티노에서 &apos;발렌티노 가라바니 락스터드 펫(VALENTINO GARAVANI Rockstud Pet)&apos; 팝업 이벤트를 진행했다. 이날 셀럽으로 배우 <b>이선빈</b>이 참석해 포토타임을 가지고 있다.","Fri, 10 Jun 2022 15:18:00 +0900"
310,"[S포토] <b>이선빈</b>, &apos;품에 쏙~&apos; (발렌티노 가라바니)",http://www.stardailynews.co.kr/news/articleView.html?idxno=323802,http://www.stardailynews.co.kr/news/articleView.html?idxno=323802,"이탈리아 럭셔리 오트 쿠틔르 브랜드, 메종 발렌티노에서 &apos;발렌티노 가라바니 락스터드 펫(VALENTINO GARAVANI Rockstud Pet)&apos; 팝업 이벤트를 진행했다. 이날 셀럽으로 배우 <b>이선빈</b>이 참석해 포토타임을 가지고 있다.","Fri, 10 Jun 2022 15:18:00 +0900"
311,"[S포토] <b>이선빈</b>, &apos;같이 왔어요~&apos; (발렌티노 가라바니)",http://www.stardailynews.co.kr/news/articleView.html?idxno=323803,http://www.stardailynews.co.kr/news/articleView.html?idxno=323803,"이탈리아 럭셔리 오트 쿠틔르 브랜드, 메종 발렌티노에서 &apos;발렌티노 가라바니 락스터드 펫(VALENTINO GARAVANI Rockstud Pet)&apos; 팝업 이벤트를 진행했다. 이날 셀럽으로 배우 <b>이선빈</b>이 참석해 포토타임을 가지고 있다.","Fri, 10 Jun 2022 15:18:00 +0900"
312,"[S포토] <b>이선빈</b>, &apos;가자~&apos; (발렌티노 가라바니)",http://www.stardailynews.co.kr/news/articleView.html?idxno=323800,http://www.stardailynews.co.kr/news/articleView.html?idxno=323800,"이탈리아 럭셔리 오트 쿠틔르 브랜드, 메종 발렌티노에서 &apos;발렌티노 가라바니 락스터드 펫(VALENTINO GARAVANI Rockstud Pet)&apos; 팝업 이벤트를 진행했다. 이날 셀럽으로 배우 <b>이선빈</b>이 참석해 포토타임을 가지고 있다.","Fri, 10 Jun 2022 15:18:00 +0900"
313,[포토] 던 &apos;현아가 반한 몽환미&apos;,https://isplus.joins.com/2022/06/10/enter/entertainment/20220610151615528.html,https://n.news.naver.com/mnews/article/241/0003128879?sid=106,"가수 던이 10일 오후 서울 용산구 한남동 앤트러사이트에서 열린 한 패션 브랜드 팝업 행사에 참석해 포토타임을 갖고 있다. 이날 행사에는 샤이니 키, 이던, <b>이선빈</b>, 기은세 등이 참석했다. ,kr/2022.06.10","Fri, 10 Jun 2022 15:17:00 +0900"
314,[포토] 던 &apos;현아 언제 오는지 머리 긁어 봐&apos;,https://isplus.joins.com/2022/06/10/enter/entertainment/20220610151515969.html,https://n.news.naver.com/mnews/article/241/0003128878?sid=106,"가수 던이 10일 오후 서울 용산구 한남동 앤트러사이트에서 열린 한 패션 브랜드 팝업 행사에 참석해 포토타임을 갖고 있다. 이날 행사에는 샤이니 키, 이던, <b>이선빈</b>, 기은세 등이 참석했다. ,kr/2022.06.10","Fri, 10 Jun 2022 15:16:00 +0900"
315,"[포토] <b>이선빈</b>, &apos;아름다운 모습에 눈길~&apos;",https://www.hankyung.com/entertainment/article/202206102662H,https://n.news.naver.com/mnews/article/015/0004710011?sid=106,배우 <b>이선빈</b>이 10일 오후 서울 한남동 엔트러사이트에서 열린 &apos;발렌티노 가라바니 락스터드 펫&apos; 팝업 이벤트 행사에 참석해 반려견 &apos;무스&apos;와 포토타임을 갖고 있다.,"Fri, 10 Jun 2022 15:16:00 +0900"
316,"[포토] <b>이선빈</b>, &apos;귀여운 반려견 무스 안고~&apos;",https://www.hankyung.com/entertainment/article/202206102661H,https://n.news.naver.com/mnews/article/015/0004710010?sid=106,배우 <b>이선빈</b>이 10일 오후 서울 한남동 엔트러사이트에서 열린 &apos;발렌티노 가라바니 락스터드 펫&apos; 팝업 이벤트 행사에 참석해 반려견 &apos;무스&apos;와 포토타임을 갖고 있다.,"Fri, 10 Jun 2022 15:15:00 +0900"
317,"[포토] <b>이선빈</b>, &apos;반려견 무스와 즐거운 미소~&apos;",https://www.hankyung.com/entertainment/article/202206102658H,https://n.news.naver.com/mnews/article/015/0004710009?sid=106,배우 <b>이선빈</b>이 10일 오후 서울 한남동 엔트러사이트에서 열린 &apos;발렌티노 가라바니 락스터드 펫&apos; 팝업 이벤트 행사에 참석해 반려견 &apos;무스&apos;와 포토타임을 갖고 있다.,"Fri, 10 Jun 2022 15:15:00 +0900"
318,[포토] 던 &apos;햇님과 시크한 케미&apos;,https://isplus.joins.com/2022/06/10/enter/entertainment/20220610151415781.html,https://n.news.naver.com/mnews/article/241/0003128877?sid=106,"가수 던이 10일 오후 서울 용산구 한남동 앤트러사이트에서 열린 한 패션 브랜드 팝업 행사에 참석해 포토타임을 갖고 있다. 이날 행사에는 샤이니 키, 이던, <b>이선빈</b>, 기은세 등이 참석했다. ,kr/2022.06.10","Fri, 10 Jun 2022 15:15:00 +0900"
319,[포토] 던 &apos;햇님 지금 떨고 있니&apos;,https://isplus.joins.com/2022/06/10/enter/entertainment/20220610151325968.html,https://n.news.naver.com/mnews/article/241/0003128876?sid=106,"가수 던이 10일 오후 서울 용산구 한남동 앤트러사이트에서 열린 한 패션 브랜드 팝업 행사에 참석해 포토타임을 갖고 있다. 이날 행사에는 샤이니 키, 이던, <b>이선빈</b>, 기은세 등이 참석했다. ,kr/2022.06.10","Fri, 10 Jun 2022 15:14:00 +0900"
320,"[포토] <b>이선빈</b>, &apos;반려견 무스와 눈맞춤~&apos;",https://www.hankyung.com/entertainment/article/202206102629H,https://n.news.naver.com/mnews/article/015/0004710007?sid=106,배우 <b>이선빈</b>이 10일 오후 서울 한남동 엔트러사이트에서 열린 &apos;발렌티노 가라바니 락스터드 펫&apos; 팝업 이벤트 행사에 참석해 반려견 &apos;무스&apos;와 포토타임을 갖고 있다.,"Fri, 10 Jun 2022 15:14:00 +0900"
321,[포토] 던 &apos;우리햇님이 우쭈쭈&apos;,https://isplus.joins.com/2022/06/10/enter/entertainment/20220610151225832.html,https://n.news.naver.com/mnews/article/241/0003128875?sid=106,"가수 던이 10일 오후 서울 용산구 한남동 앤트러사이트에서 열린 한 패션 브랜드 팝업 행사에 참석해 포토타임을 갖고 있다. 이날 행사에는 샤이니 키, 이던, <b>이선빈</b>, 기은세 등이 참석했다. ,kr/2022.06.10","Fri, 10 Jun 2022 15:13:00 +0900"
